{
  "schema": 1,
  "id": "ai",
  "name": "AI Tools",
  "version": "0.0.1",
  "description": "Install AI tools and agents",
  "order": 9,
  "min_core_api": 1,
  "platforms": [
    "linux"
  ],
  "executor": "legacy-bash",
  "protocol": "tty-v1",
  "operations": [
    "menu",
    "status",
    "install",
    "remove",
    "uninstall",
    "use"
  ]
}
