{
  "schema": 1,
  "id": "rea",
  "name": "REA: Reverse Engineer Anything",
  "version": "0.0.1",
  "description": "Install, update and remove REA with dependency checks",
  "order": 16,
  "min_core_api": 1,
  "platforms": [
    "linux"
  ],
  "executor": "legacy-bash",
  "protocol": "tty-v1",
  "operations": [
    "menu",
    "status",
    "install",
    "remove",
    "uninstall"
  ]
}
