{
  "schema": 1,
  "id": "node",
  "name": "Node.js",
  "version": "0.0.1",
  "description": "Install and manage Node.js versions",
  "order": 10,
  "min_core_api": 1,
  "platforms": [
    "linux"
  ],
  "executor": "legacy-bash",
  "protocol": "tty-v1",
  "operations": [
    "menu",
    "status",
    "install",
    "remove",
    "uninstall",
    "use"
  ]
}
