{
  "schema": 1,
  "id": "docker",
  "name": "Docker",
  "version": "0.0.1",
  "description": "Install Docker Engine, Docker Compose, and Docker Desktop",
  "order": 8,
  "min_core_api": 1,
  "platforms": [
    "linux"
  ],
  "executor": "legacy-bash",
  "protocol": "tty-v1",
  "operations": [
    "menu",
    "status",
    "install",
    "remove",
    "uninstall",
    "use"
  ]
}
